{
  "schemaVersion": 1,
  "seed": "12297829382473034410",
  "os": "macos",
  "platform": "MacIntel",
  "chromeMajor": 150,
  "hardwareConcurrency": 10,
  "deviceMemory": 8,
  "gpu": {
    "vendor": "Google Inc. (Apple)",
    "renderer": "ANGLE (Apple, ANGLE Metal Renderer: Apple M2 Pro, Unspecified Version)",
    "architecture": "apple-gpu",
    "device": "Apple M2 Pro"
  },
  "screen": {
    "w": 1512,
    "h": 982,
    "dpr": 2,
    "colorDepth": 30,
    "pixelDepth": 30,
    "availW": 1512,
    "availH": 944
  },
  "languages": ["en-US", "en"],
  "locale": "en-US",
  "timezone": "America/Los_Angeles"
}
