{
  "schemaVersion": 1,
  "seed": 2233445566778899001,
  "os": "windows",
  "platform": "Win32",
  "chromeMajor": 150,
  "hardwareConcurrency": 16,
  "deviceMemory": 8,
  "gpu": {
    "vendor": "Google Inc. (NVIDIA)",
    "renderer": "ANGLE (NVIDIA, NVIDIA GeForce RTX 4060 Laptop GPU (0x00002882) Direct3D11 vs_5_0 ps_5_0, D3D11)",
    "architecture": "ada",
    "device": "NVIDIA GeForce RTX 4060 Laptop GPU"
  },
  "screen": {
    "w": 1920,
    "h": 1080,
    "dpr": 1,
    "colorDepth": 24,
    "pixelDepth": 24,
    "availW": 1920,
    "availH": 1032
  },
  "languages": [
    "de-DE",
    "de"
  ],
  "locale": "de-DE",
  "timezone": "Europe/Berlin"
}